{
  "$schema": "http://json-schema.org/draft-07/schema#",
  "title": "SceneTemplate",
  "type": "object",
  "required": ["sceneId", "displayNameKey", "background", "doors"],
  "properties": {
    "sceneId": { "type": "string", "pattern": "^[a-z0-9-]+$" },
    "displayNameKey": { "type": "string" },
    "descriptionKey": { "type": "string" },
    "sceneType": { "enum": ["indoor", "outdoor"] },
    "background": {
      "type": "object",
      "required": ["assetPath", "width", "height"],
      "properties": {
        "assetPath": { "type": "string" },
        "width": { "type": "number", "minimum": 1 },
        "height": { "type": "number", "minimum": 1 }
      }
    },
    "doors": {
      "type": "array",
      "items": {
        "type": "object",
        "required": ["id", "position", "size", "spawnPoint"],
        "properties": {
          "id": { "type": "string", "pattern": "^door-[a-z0-9-]+$" },
          "position": { "$ref": "#/$defs/point" },
          "size": { "$ref": "#/$defs/size" },
          "targetSceneId": { "type": "string" },
          "targetDoorId": { "type": "string" },
          "spawnPoint": { "$ref": "#/$defs/point" },
          "spriteKey": { "type": "string" },
          "interactionRadius": { "type": "number", "minimum": 0, "maximum": 1 }
        }
      }
    },
    "spawnPoints": {
      "type": "array",
      "items": {
        "type": "object",
        "required": ["id", "position", "purpose"],
        "properties": {
          "id": { "type": "string" },
          "position": { "$ref": "#/$defs/point" },
          "purpose": { "enum": ["initial", "chaos-button", "general"] }
        }
      }
    },
    "objectZones": {
      "type": "array",
      "items": {
        "type": "object",
        "required": ["id", "bounds"],
        "properties": {
          "id": { "type": "string" },
          "bounds": { "$ref": "#/$defs/rect" },
          "label": { "type": "string" },
          "zIndex": { "type": "integer" }
        }
      }
    },
    "defaultObjects": {
      "type": "array",
      "items": {
        "type": "object",
        "required": ["objectId", "position"],
        "properties": {
          "objectId": { "type": "string" },
          "position": { "$ref": "#/$defs/point" },
          "zIndex": { "type": "integer" },
          "state": { "type": "string" }
        }
      }
    }
  },
  "$defs": {
    "point": {
      "type": "object",
      "required": ["x", "y"],
      "properties": {
        "x": { "type": "number", "minimum": 0, "maximum": 1 },
        "y": { "type": "number", "minimum": 0, "maximum": 1 }
      }
    },
    "size": {
      "type": "object",
      "required": ["w", "h"],
      "properties": {
        "w": { "type": "number", "minimum": 0, "maximum": 1 },
        "h": { "type": "number", "minimum": 0, "maximum": 1 }
      }
    },
    "rect": {
      "type": "object",
      "required": ["x", "y", "w", "h"],
      "properties": {
        "x": { "type": "number", "minimum": 0, "maximum": 1 },
        "y": { "type": "number", "minimum": 0, "maximum": 1 },
        "w": { "type": "number", "minimum": 0, "maximum": 1 },
        "h": { "type": "number", "minimum": 0, "maximum": 1 }
      }
    }
  }
}
